id	text	likes
54766	"Если прикинуть, сколько раз мы клялись жизнью близких родственников, чтобы придать правдоподобность какой-нибудь гнусной лжи, каждый из нас должен был осиротеть не меньше дюжины раз.

Д. Кинг"	158
54763	"Я где-то читал, что динозавры вымерли потому, что их не гладили. Надеюсь, что мужчины не повторят подобной ошибки с женщинами.

Фабио Воло «Моё большое маленькое Я»"	1026
54762	"Любовь не всегда приходит по твоему желанию. Иногда это случается против твоей воли.

 Вирджиния Эндрюс  «Цветы на чердаке»"	566
54761	"Вы знаете, что люди могут не вернуться?
Зажав всю волю в кулаке, вас отпустить?
И как-то утром с мыслями, но не о вас, проснуться
И больше вас не ждать и не о вас грустить.
Вы знаете, что люди могут не вернуться?
Не выдержать, свой мир сломав, вас не простить?
И со слезами на глазах от вас на 100 ключей замкнуться.
И понимая, что нет сил, вас навсегда забыть.
Задумайтесь, о том, что люди могут не вернуться.
И могут не писать, не волноваться, могут не звонить.
И никогда, и никогда вам к ним уже не прикоснуться.
Задумайтесь, а кто ещё вас сможет так же полюбить?"	651
54760	"— Мне всегда казалось: все, что случается до восемнадцати лет, это пустяки, — сказала Мэри.
— Так оно и есть, — подхватил Эйб. — И то, что случается после, — тоже.

Фрэнсис Скотт Фицджеральд
Ночь нежна"	383
54759	"Хочу жить легко, когда всё просто. Когда можешь сказать люблю там и где тебе хочется. Когда можешь вести себя так, словно никто не видит. Когда ты ничего никому не должен. Когда ничего от тебя не ждут и ты ни от кого не зависишь. Когда можно не отвечать на вопросы: Почему ты это делаешь, Зачем? Где? Когда? Откуда?
Когда я говорю прости, я не говорю это искренне, потому что не чувствую свою вину. Я её вообще редко чувствую… точнее даже не помню случая, когда бы я её чувствовал. Это касается очень многих вещей. 
Единственное слово, в котором я по-настоящему отдаю душу, это слово – Люблю.
Могу врать, искренне смотря в глаза – да потому что вины не чувствую и не вижу в этом ничего дурного. 
Могу лицемерить, язвить, унижать, но предать – никогда.
М."	466
54758	"Ах, какую боль может причинить невзначай заданный вопрос!

Джоанн Харрис"	282
54756	"- Вся сила женщины в волосах- в них заключено электричество. Когда твой муж ляжет подле тебя, распусти волосы, чтобы они касались его лица: тебя он может забыть, но запах твоих волос никогда. Никогда не души их духами, волосы должны пахнуть тобой. 

А. Н. Толстой ""Чудаки""."	563
54755	"Как ты не понимаешь: и один мой волос, который останется на подушке, когда я утром уйду, реальнее всех твоих слов, вместе взятых. 

Михаил Шишкин. ""Венерин Волос"""	242
54752	"Женщина - это вам не металлическая мебель; она - цветок. Она не хочет деловитости. Ей нужны солнечные, милые слова. Лучше говорить ей каждый день что-нибудь приятное, чем всю жизнь с угрюмым острервенением работать на нее. Это я вам говорю.

Э. М. Ремарк ""Три товарища"""	394
54751	"Порядочного человека можно легко узнать по тому, как неуклюже он делает подлости.

Михаил Жванецкий"	393
54750	"Сейчас такое время: человечность принимают за слабость, а сволочизм и легкую степень дебилизма — за волевой характер. Разве не так?""

Хаус"	476
54749	"Только одно мне противно, и только одного я не переношу - отговорок, пустых слов, вранья - меня от них тошнит! 
 
Стефан Цвейг. Нетерпение сердца"	329
54748	"У женщин странная привычка: прижимать к сердцу нож, который нанёс им рану. 
 
Джером Клапка Джером"	738
54747	"Душевные раны не зримы, но они никогда не закрываются, всегда мучительные, всегда кровоточащие, они вечно остаются развернутыми в глубинах человеческой души.

Александр Дюма"	203
54742	"Вспомни себя год назад. Много что изменилось. Одни стали ближе, другие ушли.

М. Леви"	666
54740	"Я всегда думал, что если ты уйдешь - жизнь остановится.
но она продолжает идти и меня волочить за шиворот.
вру.
Я никогда не думал, что ты уйдешь.
никогда. (с)"	753
54739	"…он шел и думал о том, как часто приходится в жизни встречаться с хорошими людьми и как жаль, что от этих встреч не остается ничего больше, кроме воспоминаний… выйдет он сейчас за калитку, и все это обратится в воспоминание и утеряет для него навсегда свое реальное значение, а пройдет год-два, и все эти милые образы потускнеют в сознании наравне с вымыслами и плодами фантазии…

Антон Павлович Чехов “Верочка”"	327
54738	"Люди думают, что первая любовь — сплошная романтика и нет ничего романтичнее первого разрыва. Сотни песен сложили о том, как какому-то дураку разбили сердце. Вот только в первый раз сердце разбивается больнее всего, и заживает медленнее, и шрам остаётся самый заметный. И что в этом романтичного?

 Стивен Кинг
«Страна радости (Джойленд)»"	669
54737	"Романтик сказал бы: я чувствую, что наши дороги начинают расходиться, а я просто говорю, что мы друг другу приелись.

Иван Сергеевич Тургенев ""Отцы и дети"""	284
54736	"Когда я попросил Алису выйти за меня замуж, она дала ответ, полный нежности, романтики, проницательности, красоты и теплоты. 
– Нет. 

Фредерик Бегбедер. Любовь живет три года"	687
54733	"В жизни каждого человека, наверное, найдутся минуты, с воспоминаниями о которых он не захочет расстаться.

Уильям Уилки Коллинз «Лунный камень»"	702
54732	"Ты никогда не пройдёшь свой путь до конца, если будешь останавливаться, чтобы бросить камень в каждую тявкающую собаку.

Сэр Уинстон Черчилль"	1154
54731	Прежде чем осуждать кого-то, возьми его обувь и пройди его путь, попробуй его слезы, почувствуй его боль. Наткнись на каждый камень, о который он споткнулся. И только после этого говори, что ты знаешь - как правильно жить. (с)	428
54730	"…Работать идти? А не хочу я на вас работать, тошнит меня от вашей работы, можете вы это понять? 

Аркадий и Борис Стругацкие."	310
54728	"Хоть разок хотелось любви получить досыта. Чтобы аж хотелось сказать: «Хватит уже, сейчас лопну, спасибо». Хоть разок, хоть один разок.

Харуки Мураками ""Норвежский лес"""	968
54726	"Тогда, когда любовей с нами нет, 
тогда, когда от холода горбат, 
достань из чемодана пистолет, 
достань и заложи его в ломбард. 
Купи на эти деньги патефон 
и где-нибудь на свете потанцуй

И. Бродский"	765
54725	"Если б знал, что тебя не увижу,
я бы крепче тебя держал,
не пустил бы гулять по Парижу
и тем более — на вокзал.

Не купил бы тебе билеты,
не пустил бы тебя за порог,
если б знал, что вот это лето —
окончание, эпилог.

Целовал бы всё ниже и ниже,
не хранил бы в себе мечты,
если б знал, что тебя не увижу,
я бы чаще дарил цветы,

я бы чаще тобой восхищался,
я бы верил в нашу любовь...
А на деле — с тобою прощался,
был уверен, что встретимся вновь!

К. Крамер"	1362
54724	"А вот бывает, что у мужчины есть женщина, которая любит его всегда. Она даже может быть замужем, но все равно «ждет его всю жизнь». И вот тебе не хватает любви, или внимания… или просто скучно – и ты ей звонишь. Или даже заезжаешь… ну, так, импульс получить, почувствовать, что тебя любят. Подлость же, в общем, но так приятно. А она потом думает об этом, на картах гадает, гороскоп твой купила… звонит подругам, советуется, «как думаешь, что он имел в виду?». А ты ничего не имел в виду… вышел и забыл.

«Разговоры мужчин…»"	1486
54722	"Мы ждали и ждали. Вместе. Не знает, что ли, психиатр, что ожидание — одна из тех вещей, которые сводят людей с ума? Всю жизнь люди ждут. Ждут новой жизни, ждут смерти. Ждут в очереди за туалетной бумагой. Ждут в очереди за деньгами. А если денег нет, ждут в очередях подольше. Ждешь, когда уснешь, а потом ждешь, когда проснешься. Ждешь женитьбу и ждешь развода. Ждешь дождя, ждешь, когда он кончится. Ждешь еды, а потом снова ждешь еды. Ждешь в приемной у врача вместе с психами и опасаешься, что ты один из них.

Чарльз Буковски. Макулатура."	973
54721	"Найди то, что любишь, и пусть это убьёт тебя.

Чарльз Буковски"	847
54720	"Как можно доверять существу, которое каждый месяц кровоточит и не умирает?! 

Чарльз Буковски"	534
54717	"Одиночество укрепляет меня; без него я как без еды и воды. Каждый день без него обессиливает меня. Я не горжусь своим одиночеством, но я завишу от него. 

Чарльз Буковски"	436
54716	"Я любил свою кровать и мог оставаться в ней часами, даже днем, натянув покрывало до самого подбородка. Здесь было покойно, никаких происшествий, никаких людей, ничего.

Чарльз Буковски. ""Хлеб с ветчиной""."	1002
54715	"Вы не представляете себе, как быстро проходят 25 дней, когда ты не хочешь, чтобы они прошли.

Чарльз Буковски. Макулатура"	781
54714	"Любовь - это нормально для тех, кто может справиться с психическими перегрузками

Чарльз Буковски"	623
54711	"Судьба не бывает добра к тем, кто слишком робок.

Кристофер Паолини ""Эрагон возвращение"""	383
54709	"Сам я к лгунам отношусь с пониманием. Женщина, которая не лжет, — это женщина без воображения, а такие женщины мне не симпатичны.

Агата Кристи «Труп в библиотеке»"	427
54708	"Эти гангстеры нас застрелят, полиция найдёт два женских трупа, нас отвезут в женский морг, и, когда нас там разденут, я умру со стыда!

к/ф ""В джазе только девушки"" (1959)."	332
54707	"Я считаю, в ноябре каждый порядочный человек должен от трех до десяти дней проваляться в депрессии. Если вы почему-либо не валяетесь, как алюминиевая ложка, это говорит о недостаточно тонкой душевной организации. Поэтому хотя бы не признавайтесь никому, не позорьтесь.

- Марта Кетро ""Справочник по уходу и возвращению"""	2427
54706	"Какой смысл предлагать мне луну, если у меня гвоздь в туфле, а ты не можешь его вытащить?

Сомерсет Моэм ""К Востоку от Суэца"""	1380
54704	"Не смерти я боюсь — я боюсь жизни. Это она, сколько себя помню, всегда казалась мне непостижимой и страшной. Полная моя неспособность в нее вписаться. Отсюда и страх перед людьми, как будто они — существа другой природы. Постоянное чувство, что между нами нет ничего общего. 

Эмиль Мишель Чоран. Молитва неверующего"	428
54703	"Странные мы существа: если мы чего-то не понимаем, нас это бесит. Нам обязательно нужно навешать на все ярлыки, разложить все по полочкам, все объяснить. Даже то, что по природе своей необъяснимо. Даже Господа Бога. 

Чак Паланик, ""Удушье"""	402
54701	"Я не хочу стать таким вот запросто позабытым человеком, очень важным когда-то, очень значимым и ценимым, который несколько лет спустя становится этаким, знаешь, смутным воспоминанием.

Ахерн Сесилия. «Там, где заканчивается радуга.»"	365
54700	"Пусть у тебя будет сердце, которое никогда не ожесточится, и характер, который никогда не испортится, и прикосновение, которое никогда не ранит. 

Чарльз Диккенс."	1145
54699	"Последние слова знаменитых людей.

Оскар Уайльд умирал в комнате с безвкусными обоями. Приближающаяся смерть не изменила его отношение к жизни. После слов: «Убийственная расцветка! Одному из нас придётся отсюда уйти», он ушёл.

Английский писатель-прозаик Сомерсет Моэм: «Умирать — скучное и безотрадное дело. Мой вам совет — никогда этим не занимайтесь».

Русский писатель-сатирик Салтыков-Щедрин приветствовал смерть вопросом «Это ты, дура?».

Английский писатель и критик Литтон Стрейчи: «Если это и есть смерть, то я от неё не в восторге».

Американский драматург Юджин О`Нил: «Я так и знал! Я так и знал! Родился в отеле и, чёрт побери, умираю в отеле».

Императрица Елизавета Петровна крайне удивила лекарей, когда за полминуты до смерти поднялась на подушках и грозно спросила: «Я что, всё ещё жива?!». Но не успели врачи испугаться, как всё исправилось само собой."	355
54698	"Знаю, что больше никто и ничто не сможет внушить мне страсть. Понимаешь, начать кого-нибудь любить – это целое дело. Нужна энергия, любопытство, ослепленность… Вначале бывает даже такая минута, когда нужно перепрыгнуть пропасть: стоит задуматься, и этого уже не сделаешь. Я знаю, что больше никогда не прыгну.

Жан-Поль Сартр. ""Тошнота""."	1379
54697	"Одно из преимуществ возраста в том, что объектов, вызывающих любопытство, становится все меньше.

Х. Мураками ""Ничья на карусели"""	1032
54696	"… между прочим, в прошлый раз у тебя мобильник не отключился, и я минут пять сидел, слушал, как ты идёшь по снегу. Туп-туп, туп-туп. Я чуть не заплакал. 
 
Линор Горалик, «Говорит»"	1194
54695	"Когда явный псих твердо обещает, что с тобой все будет в порядке - жди беды. 
 
Макс Фрай. ""Хроники Ехо"""	416
54694	"Когда женщина пошла против тебя, забудь про нее. Они могут любить, но потом что-то у них внутри переворачивается. И они могут спокойно смотреть, как ты подыхаешь в канаве, сбитый машиной, и им плевать на тебя.

Чарльз Буковски"	692
54691	"Я, когда тебя увидела, у меня сердце остановилось. Я тогда поняла, что у меня жизнь изменится. Я тогда видела глаза твои наглые и понимала, что покоя с тобой не будет. Но мне это было неважно. И я поняла, что я тебя ждала..  Всегда.

к/ф ""Красный жемчуг любви"""	1551
54690	"Бабуля говорит, люди от ревности зеленеют. По-моему, это не так. Зеленый — спокойный цвет. Свежий цвет. Чистый и прохладный, как ментоловая зубная паста. А ревность — красная! Она опаляет вены и выжигает кишки.

Аннабель Питчер «Моя сестра живет на каминной полке»"	328
54688	"Потом он обнял меня: человек, умеющий обнимать - хороший человек.

Орхан Памук. «Меня зовут красный»"	703
54686	"– Ты пришла?
– Похоже на то.
– Почему ты не пришла в понедельник и во вторник?
– Был дождь…
– Я тебе сейчас, кажется… подарю зонтик.

Фредерик Бегбедер. Любовь живёт три года"	825
54684	"Усвойте и ужаснитесь: моя истинная родина - это постель, в которой спит моя жена.

Марио Варгас Льоса. ""Капитан Панталеон и Рота добрых услуг"""	1566
